{
  "schema_version": "1.0",
  "id": "email_digest",
  "name": "Email Digest",
  "version": "0.3.0",
  "description": "Builds a daily inbox digest and sends a summary to your preferred channel.",
  "components": {
    "client": {
      "runtime": "python",
      "entry": "client/plugin.py"
    }
  },
  "config_schema": {
    "client": {
      "type": "object",
      "properties": {
        "timezone": {
          "type": "string"
        }
      },
      "additionalProperties": true
    },
    "server": {
      "type": "object",
      "properties": {},
      "additionalProperties": true
    }
  }
}
